<!ELEMENT database (employee+)>
<!ELEMENT employee (name,department,age,gender,city)>
<!ELEMENT name (#PCDATA)>
<!ELEMENT department (#PCDATA)>
<!ELEMENT age (#PCDATA)>
<!ELEMENT gender (#PCDATA)>
<!ELEMENT city (#PCDATA)>